{
  "$id": "tome_content_manifest_header_v4",
  "$schema": "https://json-schema.org/draft/2020-12/schema",
  "additionalProperties": false,
  "properties": {
    "capabilities_ref": {
      "$id": "radjax_tome_reference_v1",
      "$schema": "https://json-schema.org/draft/2020-12/schema",
      "additionalProperties": false,
      "properties": {
        "path": {
          "minLength": 1,
          "pattern": "^[A-Za-z0-9][A-Za-z0-9._/-]*$",
          "type": "string"
        },
        "schema_version": {
          "minLength": 1,
          "pattern": "^[^\\x00\\r\\n]+$",
          "type": "string"
        },
        "sha256": {
          "pattern": "^sha256:[0-9a-f]{64}$",
          "type": "string"
        },
        "size_bytes": {
          "maximum": 9223372036854775807,
          "minimum": 0,
          "type": "integer"
        }
      },
      "required": [
        "path",
        "sha256",
        "size_bytes",
        "schema_version"
      ],
      "type": "object"
    },
    "contract_version": {
      "const": "radjax_tome_artifact_contract@3.0.0"
    },
    "entry_count": {
      "maximum": 9223372036854775807,
      "minimum": 0,
      "type": "integer"
    },
    "inventory_ref": {
      "$id": "radjax_tome_reference_v1",
      "$schema": "https://json-schema.org/draft/2020-12/schema",
      "additionalProperties": false,
      "properties": {
        "path": {
          "minLength": 1,
          "pattern": "^[A-Za-z0-9][A-Za-z0-9._/-]*$",
          "type": "string"
        },
        "schema_version": {
          "minLength": 1,
          "pattern": "^[^\\x00\\r\\n]+$",
          "type": "string"
        },
        "sha256": {
          "pattern": "^sha256:[0-9a-f]{64}$",
          "type": "string"
        },
        "size_bytes": {
          "maximum": 9223372036854775807,
          "minimum": 0,
          "type": "integer"
        }
      },
      "required": [
        "path",
        "sha256",
        "size_bytes",
        "schema_version"
      ],
      "type": "object"
    },
    "layout_ref": {
      "$id": "radjax_tome_reference_v1",
      "$schema": "https://json-schema.org/draft/2020-12/schema",
      "additionalProperties": false,
      "properties": {
        "path": {
          "minLength": 1,
          "pattern": "^[A-Za-z0-9][A-Za-z0-9._/-]*$",
          "type": "string"
        },
        "schema_version": {
          "minLength": 1,
          "pattern": "^[^\\x00\\r\\n]+$",
          "type": "string"
        },
        "sha256": {
          "pattern": "^sha256:[0-9a-f]{64}$",
          "type": "string"
        },
        "size_bytes": {
          "maximum": 9223372036854775807,
          "minimum": 0,
          "type": "integer"
        }
      },
      "required": [
        "path",
        "sha256",
        "size_bytes",
        "schema_version"
      ],
      "type": "object"
    },
    "profile_id": {
      "const": "selected_exemplar_semantic_profile_v3"
    },
    "schema_version": {
      "const": "tome_content_manifest_header_v4"
    },
    "semantic_identity_ref": {
      "$id": "radjax_tome_reference_v1",
      "$schema": "https://json-schema.org/draft/2020-12/schema",
      "additionalProperties": false,
      "properties": {
        "path": {
          "minLength": 1,
          "pattern": "^[A-Za-z0-9][A-Za-z0-9._/-]*$",
          "type": "string"
        },
        "schema_version": {
          "minLength": 1,
          "pattern": "^[^\\x00\\r\\n]+$",
          "type": "string"
        },
        "sha256": {
          "pattern": "^sha256:[0-9a-f]{64}$",
          "type": "string"
        },
        "size_bytes": {
          "maximum": 9223372036854775807,
          "minimum": 0,
          "type": "integer"
        }
      },
      "required": [
        "path",
        "sha256",
        "size_bytes",
        "schema_version"
      ],
      "type": "object"
    }
  },
  "required": [
    "schema_version",
    "contract_version",
    "profile_id",
    "capabilities_ref",
    "semantic_identity_ref",
    "layout_ref",
    "inventory_ref",
    "entry_count"
  ],
  "type": "object"
}
