{"capabilities_ref":{"path":"provenance/capabilities.json","schema_version":"radjax_tome_capabilities_v1","sha256":"sha256:aec065969dbe8c8ed89b5111b9155c8533d71db312329d7de906acd036a3cfcd","size_bytes":129},"contract_version":"radjax_tome_artifact_contract@3.0.0","entry_count":9,"inventory_ref":{"path":"manifests/content-manifest-inventory.jsonl","schema_version":"tome_content_manifest_inventory_v4","sha256":"sha256:4f04abb474c7b3b1c7acd6e28334fbdace629a8f25260b01a0a270f04ca2efad","size_bytes":2368},"layout_ref":{"path":"selected_exemplars/layout.json","schema_version":"radjax_tome_payload_layout_v2","sha256":"sha256:2bcc94c0f8f8d972ff1d56d16b187ca8503ba861e247cb49f43a00b5dfa4387c","size_bytes":782},"profile_id":"selected_exemplar_semantic_profile_v3","schema_version":"tome_content_manifest_header_v4","semantic_identity_ref":{"path":"provenance/semantic-identity.json","schema_version":"radjax_tome_semantic_identity_v3","sha256":"sha256:813a6aeb11ea6dd7cda59f52c0a70a8e340527c55f73e6bc3cd18989fffb5c3b","size_bytes":593}}